{
  "$schema": "../../../.mlgs/art-batch.schema.json",
  "schemaVersion": "1.0",
  "id": "replace-me-batch",
  "visualTargetId": "VT-001",
  "sourceImage": "Assets/Game/Art/Source/replace-me-batch.png",
  "sourceLayout": "registered-sheet",
  "canvasSize": [1024, 1024],
  "matteColor": "#F5F5F5",
  "matteTolerance": 28,
  "minimumCellMargin": 12,
  "items": [
    {
      "assetId": "replace-me-icon-a",
      "rect": [32, 32, 464, 464],
      "outputPath": "Assets/Game/Art/Sprites/replace-me-icon-a.png",
      "finalSize": [256, 256],
      "safePadding": 12,
      "removeMatte": true,
      "maxSignificantComponents": 1
    },
    {
      "assetId": "replace-me-icon-b",
      "rect": [528, 32, 464, 464],
      "outputPath": "Assets/Game/Art/Sprites/replace-me-icon-b.png",
      "finalSize": [256, 256],
      "safePadding": 12,
      "removeMatte": true,
      "maxSignificantComponents": 1
    }
  ],
  "reportPath": "production/qa/evidence/art-batches/replace-me-batch.json",
  "updated": ""
}
